id,text_id,type,body
1,1,1,コインガシャの注意事項を出します（現状は仮）
2,2,1,・的中確率は、端数を四捨五入した小数点以下2ケタまでを表示しています。そのため、的中確率の合計が100％にならない場合があります。\n・ガシャをまわすと、ラインナップの「基本」の中から抽選されます。「10回まわす」ボタンからまわすと、1回だけ「確定」の中から抽選されます。\n・的中する妖怪は、ラインナップの中から毎回ランダムで抽選されます。ガシャをまわす回数で的中確率は変動いたしません。\n・抽選結果などの問い合わせには、お答えしておりません。
3,3,1,・的中確率は、端数を四捨五入した小数点以下2ケタまでを表示しています。そのため、的中確率の合計が100％にならない場合があります。\n・ガシャをまわすと、ラインナップの「基本」の中から抽選されます。「10回まわす」ボタンからまわすと、1回だけ「確定」の中から抽選されます。\n・的中する妖怪は、ラインナップの中から毎回ランダムで抽選されます。ガシャをまわす回数で的中確率は変動いたしません。\n・抽選結果などの問い合わせには、お答えしておりません。
4,4,1,チュートリアルガシャの注意事項を出します（現状は仮）
10001,10001,1,コインガシャの売り文句を出します
10002,10002,1,ランクA以上の妖怪1体確定！
10003,10003,1,妖怪ガシャの売り文句を出します
10004,10004,1,何度でも引き直し可能！
